{
  "schema_version": 1,
  "bundle_name": "p0-core-1.21.4-linux-x86_64",
  "status": "recipe",
  "launchable": false,
  "minecraft": {
    "version": "1.21.4",
    "version_metadata_url": "https://piston-meta.mojang.com/v1/packages/d152a3712859b294a2dff641f99a7fe219cd3aec/1.21.4.json",
    "version_metadata_sha1": "d152a3712859b294a2dff641f99a7fe219cd3aec"
  },
  "runtime": {
    "java_major": 21,
    "os_arch": "linux-x86_64"
  },
  "fabric": {
    "loader": "0.16.9",
    "api": "0.119.4+1.21.4",
    "yarn": "1.21.4+build.8"
  },
  "metadata": {
    "version_manifest": "../launcher/version_manifest_v2.json",
    "version_json": "../launcher/1.21.4.json",
    "fabric_profile": "../launcher/fabric-loader-0.16.9.json",
    "asset_index": "../launcher/asset-index-19.json"
  },
  "artifacts": [
    {
      "name": "fabric-api",
      "kind": "mod",
      "verification": "sha256",
      "digest": "d183bacb845167f09264c2f90322b7ecffe8826debda6f60e597889264bef4af",
      "size": 2149128,
      "source": "https://maven.fabricmc.net/net/fabricmc/fabric-api/fabric-api/0.119.4+1.21.4/fabric-api-0.119.4+1.21.4.jar",
      "license": "Apache-2.0"
    },
    {
      "name": "minekin-bridge",
      "kind": "bridge",
      "verification": "sha256",
      "digest": "caee47eacae11a880fa8c2f7551f174aab9a2b0c127ad6c46e90159a93a3af85",
      "size": 1413073,
      "source": "workspace:bridge",
      "source_digest": "a4a53cacb38d83339d46f94d651d25da004e743dded48333ce0e67db4c36413c",
      "license": "NOASSERTION"
    }
  ]
}
